[
  {
    "id": "inoreader-intelligence-reports",
    "name": "Inoreader Intelligence Reports",
    "url": "https://www.inoreader.com/blog/2026/03/automated-intelligence-reports-for-insights-delivered-to-you.html",
    "category": "saas_source_service",
    "interface_types": ["web"],
    "content_types": ["rss", "article"],
    "open_source": false,
    "agent_friendly": "low",
    "stage": "active",
    "pricing": "paid",
    "summary": "RSS reading product with automated intelligence reporting features.",
    "notes": [
      "Useful as a benchmark for reporting UX and scheduled briefing workflows.",
      "Not an agent-first or open integration surface yet."
    ],
    "last_verified": "2026-03-28"
  },
  {
    "id": "rsshub",
    "name": "RSSHub",
    "url": "https://github.com/DIYgod/RSSHub",
    "category": "open_source_project",
    "interface_types": ["rss", "web"],
    "content_types": ["rss", "article", "feed"],
    "open_source": true,
    "agent_friendly": "high",
    "stage": "active",
    "pricing": "free",
    "summary": "Open source feed generation infrastructure that turns many web sources into RSS.",
    "notes": [
      "Important upstream building block for source normalization.",
      "Relevant as infrastructure rather than a briefing product."
    ],
    "last_verified": "2026-03-30",
    "routes": {
      "/hackernews/best": ["tech", "AI", "open source"],
      "/36kr/newsflashes": ["tech", "startup"],
      "/github/trending/daily": ["open source"],
      "/github/trending/daily/python": ["python", "open source"],
      "/arxiv/cs.AI": ["AI", "machine learning"]
    }
  },
  {
    "id": "readwise-cli",
    "name": "Readwise CLI",
    "url": "https://x.com/readwise/status/2034302848805241282",
    "category": "agent_tool",
    "interface_types": ["cli"],
    "content_types": ["article", "highlight", "read_later"],
    "open_source": false,
    "agent_friendly": "medium",
    "stage": "active",
    "pricing": "paid",
    "summary": "CLI access to saved reading data that can be composed into agent workflows.",
    "notes": [
      "Strong bridge between personal knowledge workflows and agent automation.",
      "Depends on the user's upstream Readwise usage."
    ],
    "last_verified": "2026-03-28"
  },
  {
    "id": "podwise-cli",
    "name": "Podwise CLI",
    "url": "https://github.com/hardhackerlabs/podwise-cli",
    "category": "agent_tool",
    "interface_types": ["cli", "mcp", "skills"],
    "content_types": ["podcast", "transcript", "summary"],
    "open_source": true,
    "agent_friendly": "high",
    "stage": "active",
    "pricing": "mixed",
    "summary": "Podcast summarization and transcript workflow with CLI and MCP support.",
    "notes": [
      "A strong example of vertical tool design for agent consumption.",
      "Good reference for how News Report can expose structured outputs."
    ],
    "last_verified": "2026-03-28"
  },
  {
    "id": "hackernews-api",
    "name": "Hacker News API",
    "url": "https://github.com/HackerNews/API",
    "category": "open_source_project",
    "interface_types": ["api"],
    "content_types": ["article", "feed"],
    "open_source": true,
    "agent_friendly": "high",
    "stage": "active",
    "pricing": "free",
    "summary": "Official Hacker News Firebase API. Free, no auth, returns structured JSON.",
    "notes": ["Good candidate for second real adapter to validate SourceAdapter Protocol."],
    "last_verified": "2026-03-30"
  },
  {
    "id": "github-trending",
    "name": "GitHub Trending",
    "url": "https://github.com/trending",
    "category": "open_source_project",
    "interface_types": ["rss", "web"],
    "content_types": ["feed", "article"],
    "open_source": true,
    "agent_friendly": "high",
    "stage": "active",
    "pricing": "free",
    "summary": "GitHub trending repositories. Accessible via RSSHub route /github/trending/daily.",
    "notes": ["Useful for open-source and developer-tools topics."],
    "last_verified": "2026-03-30"
  },
  {
    "id": "arxiv-rss",
    "name": "arXiv RSS Feeds",
    "url": "https://arxiv.org/",
    "category": "open_source_project",
    "interface_types": ["rss"],
    "content_types": ["article", "feed"],
    "open_source": true,
    "agent_friendly": "high",
    "stage": "active",
    "pricing": "free",
    "summary": "Academic preprint RSS feeds covering AI, ML, NLP, and more.",
    "notes": ["Key source for cutting-edge AI/ML research. Available via RSSHub /arxiv/ routes."],
    "last_verified": "2026-03-30"
  },
  {
    "id": "kill-the-newsletter",
    "name": "Kill the Newsletter!",
    "url": "https://kill-the-newsletter.com/",
    "category": "processing_tool",
    "interface_types": ["rss", "email"],
    "content_types": ["article", "rss"],
    "open_source": true,
    "agent_friendly": "medium",
    "stage": "active",
    "pricing": "free",
    "summary": "Converts email newsletters into RSS feeds for agent consumption.",
    "notes": ["Bridges the gap between newsletter-only content and structured feeds."],
    "last_verified": "2026-03-28"
  },
  {
    "id": "miniflux",
    "name": "Miniflux",
    "url": "https://miniflux.app/",
    "category": "open_source_project",
    "interface_types": ["api", "web"],
    "content_types": ["rss", "article", "feed"],
    "open_source": true,
    "agent_friendly": "high",
    "stage": "active",
    "pricing": "free",
    "summary": "Minimalist self-hosted RSS reader with a clean REST API.",
    "notes": ["REST API makes it ideal for agent integration. Supports feed management + read state."],
    "last_verified": "2026-03-28"
  },
  {
    "id": "lobsters",
    "name": "Lobsters",
    "url": "https://lobste.rs/",
    "category": "open_source_project",
    "interface_types": ["rss", "web"],
    "content_types": ["article", "feed"],
    "open_source": true,
    "agent_friendly": "high",
    "stage": "active",
    "pricing": "free",
    "summary": "Technology-focused link aggregation with tag-based RSS feeds.",
    "notes": ["High signal-to-noise ratio. Tag-based RSS enables topic-specific feeds."],
    "last_verified": "2026-03-30"
  },
  {
    "id": "reddit-rss",
    "name": "Reddit RSS Feeds",
    "url": "https://www.reddit.com/.rss",
    "category": "open_source_project",
    "interface_types": ["rss", "api"],
    "content_types": ["article", "feed"],
    "open_source": false,
    "agent_friendly": "medium",
    "stage": "active",
    "pricing": "free",
    "summary": "Reddit subreddit RSS feeds. Accessible via RSSHub /reddit/subreddit/ routes.",
    "notes": ["Useful for niche topic monitoring. Rate-limited but functional via RSSHub."],
    "last_verified": "2026-03-28"
  },
  {
    "id": "youtube-transcript",
    "name": "YouTube Transcript API",
    "url": "https://github.com/jdepoix/youtube-transcript-api",
    "category": "agent_tool",
    "interface_types": ["api", "cli"],
    "content_types": ["transcript", "summary"],
    "open_source": true,
    "agent_friendly": "high",
    "stage": "active",
    "pricing": "free",
    "summary": "Python API to fetch YouTube video transcripts without an API key.",
    "notes": ["Enables turning video content into text for briefing generation."],
    "last_verified": "2026-03-28"
  },
  {
    "id": "techmeme",
    "name": "Techmeme",
    "url": "https://www.techmeme.com/",
    "category": "saas_source_service",
    "interface_types": ["rss", "web"],
    "content_types": ["article", "feed"],
    "open_source": false,
    "agent_friendly": "medium",
    "stage": "active",
    "pricing": "free",
    "summary": "Curated tech news aggregator with RSS feed.",
    "notes": ["High-quality editorial curation. RSS feed provides structured access."],
    "last_verified": "2026-03-30"
  },
  {
    "id": "feedly-api",
    "name": "Feedly API",
    "url": "https://developer.feedly.com/",
    "category": "saas_source_service",
    "interface_types": ["api", "web"],
    "content_types": ["rss", "article", "feed"],
    "open_source": false,
    "agent_friendly": "medium",
    "stage": "active",
    "pricing": "paid",
    "summary": "RSS aggregator with AI-powered topic tracking and REST API.",
    "notes": ["Leo AI feature does topic filtering. API requires paid plan."],
    "last_verified": "2026-03-28"
  },
  {
    "id": "tldr-newsletter",
    "name": "TLDR Newsletter",
    "url": "https://tldr.tech/",
    "category": "saas_source_service",
    "interface_types": ["web", "email"],
    "content_types": ["article", "rss"],
    "open_source": false,
    "agent_friendly": "low",
    "stage": "active",
    "pricing": "free",
    "summary": "Daily tech newsletter covering AI, startups, and developer tools.",
    "notes": ["Good curation quality. Can be converted to RSS via Kill the Newsletter."],
    "last_verified": "2026-03-28"
  },
  {
    "id": "transcrab",
    "name": "TransCrab",
    "url": "https://github.com/onevcat/transcrab",
    "category": "agent_tool",
    "interface_types": ["cli", "skills"],
    "content_types": ["article", "translation"],
    "open_source": true,
    "agent_friendly": "high",
    "stage": "active",
    "pricing": "free",
    "summary": "OpenClaw-first translation pipeline, turns a link into a polished translated reading page.",
    "notes": [
      "Fetch → extract → translate → deploy as static site.",
      "Good reference for content transformation and agent-driven publishing."
    ],
    "last_verified": "2026-04-02"
  },
  {
    "id": "baoyu-youtube-transcript",
    "name": "baoyu-youtube-transcript",
    "url": "https://github.com/jimliu/baoyu-skills",
    "category": "agent_tool",
    "interface_types": ["cli", "skills"],
    "content_types": ["transcript", "video"],
    "open_source": true,
    "agent_friendly": "high",
    "stage": "active",
    "pricing": "free",
    "summary": "Download YouTube video transcripts/subtitles with multi-language, chapters, and speaker identification support.",
    "notes": [